{"board":{"breaks":8,"clues":[{"c":1,"m":5,"r":0},{"c":2,"m":15,"r":1},{"c":2,"m":16,"r":2},{"c":3,"m":10,"r":3},{"c":2,"m":6,"r":4}],"cols":6,"rows":6,"spark":[3,1]},"certificates":{"deduction_steps":30,"unique":true,"witnessed":true},"engine":{"gen_version":"py-pipeline-ws05-0.1.0","rules_version":1},"grade":{"score":30,"techniques":["all_breaks_placed","clue_reached_too_fast","clue_unreachable_in_time","too_many_breaks"],"tier":"crew"},"id":"bf1-6x6-000002","schema":"burnfront.puzzle/1","solution_sha256":"d41fcd185847c3e7429ad427f5f38fe57c56ba12222c609983199952c265682b"}
